{
  "artifact_kind": "mncs.capability_gap",
  "contract_revision": "0.1",
  "gap_id": "scratchtrack/p011-host-abi",
  "producer": "scratchtrack-pressure",
  "compiler_identity": null,
  "source_revision": null,
  "source_artifact": "scratchtrack.mncsWasm",
  "source_location": "<local-path>/mncsWasm.ts",
  "requested_semantics": "target an MNCS WASM artifact from any host using only a versioned contract plus the per-module mncs abi report, without reading compiler internals",
  "obstruction": "backend",
  "active_profile": "0.7",
  "backends": [
    "mncs-portable-wasm-mvp"
  ],
  "closest_supported_semantics": "per-shape tribal knowledge in one checked-in loader",
  "reproducer": "stageView/record reads reverse-mapped from mncs-codegen lower.rs/wasm.rs (packed descriptors, 8-byte-slot cells, host-buffer/reset protocol)",
  "protected_properties": [
    "no host reads compiler internals to marshal a call"
  ],
  "approximation_prohibited": true,
  "evidence_requirements": [
    "crates/mncs-cli/tests/abi_boundary.rs: abi_report_carries_the_host_abi_version",
    "executable vectors: abi-view-returns corpora, unsigned/bool/nested/over-capacity corpora on all five backends",
    "mncs abi carries host_abi_version binding each report to the contract",
    "spec/host-abi.md HOST-ABI version 1 (envelope, scalars, exact, views, staging protocol, results, failures, vectors)"
  ],
  "status": "PASS",
  "unresolved_fields": [
    "cross-call memory-growth discipline is a host-test obligation; experiment runs reset per case",
    "returned byte views may carry the provisional bit-63 cell selector: contract documents both representations, packed-only normalization is future work"
  ],
  "identity": "mncs:0.2:capability-gap:ceb8ea54d08fcf1477ee8cc2245b167eb97e0c0702e4d4f7620fc9bc4eda0d52"
}
