{
  "artifact_kind": "mncs.capability_gap",
  "contract_revision": "0.1",
  "gap_id": "scratchtrack/p013-view-returns",
  "producer": "scratchtrack-pressure",
  "compiler_identity": null,
  "source_revision": null,
  "source_artifact": "scratchtrack.probes.textprod_slice_attempt",
  "source_location": "<local-path>/textprod_slice_attempt.mncs",
  "requested_semantics": "return a bounded byte view derived from a locally-built exact sequence with exact logical bytes on every executable backend",
  "obstruction": "backend",
  "active_profile": "0.7",
  "backends": [
    "mncs-c11",
    "mncs-cranelift",
    "mncs-llvm-ir",
    "mncs-portable-wasm-mvp",
    "mncs-research-bytecode"
  ],
  "closest_supported_semantics": "fixed-width exact sequence returns; host-side byte production",
  "reproducer": "slice02/slice13 over buf[0..2]/buf[1..3] (textprod_slice_attempt.mncs + textprod_slice-corpus.json)",
  "protected_properties": [
    "cross-backend logical-value agreement on returned views"
  ],
  "approximation_prohibited": true,
  "evidence_requirements": [
    "crates/mncs-cli/tests/abi_boundary.rs: view_returns_agree_per_backend on all five executable backends",
    "examples/execution/abi-view-returns-corpus.json via scripts/gen_abi_view_returns_corpus.py",
    "examples/execution/abi-view-returns-traps-corpus.json: OOB-index and reversed-slice runtime_failure uniformly",
    "examples/source/abi-view-returns.mncs (18 value cases incl. P-013 vectors, empty/len-1/max-64/odd-even/param-slice/non-byte/repeated)"
  ],
  "status": "PASS",
  "unresolved_fields": [
    "external-host return descriptors may still carry the lowering-internal bit-63 cell marker: versioned host ABI contract (P-011) must normalize-or-document",
    "integer-overflow obligations remain UNKNOWN (P-003; values verified, universal discharge missing)"
  ],
  "identity": "mncs:0.2:capability-gap:d25ba02fe50832d96fa25a4dfc9c3f4c0b0ee3718c3403d90edcc4649417b162"
}
