{
  "artifact_kind": "mncs.capability_gap",
  "contract_revision": "0.1",
  "gap_id": "scratchtrack/p014-nominal-imports",
  "producer": "scratchtrack-pressure",
  "compiler_identity": null,
  "source_revision": null,
  "source_artifact": "test.nominal.consumer",
  "source_location": "<local-path>/consumer.mncs",
  "requested_semantics": "import nominal finite and record identities across modules: signatures, returns, projection, finite values, match, nested calls, backend ABI identity",
  "obstruction": "typing",
  "active_profile": "0.6",
  "backends": [
    "mncs-c11",
    "mncs-cranelift",
    "mncs-llvm-ir",
    "mncs-portable-wasm-mvp",
    "mncs-research-bytecode"
  ],
  "closest_supported_semantics": "per-module local re-declaration of shared vocabularies",
  "reproducer": "events_import_attempt.mncs (STALE: names PlatformEvent, absent from current platform.v1) superseded by test.nominal.machine/consumer pair",
  "protected_properties": [
    "imported nominals keep their declaring identity end to end"
  ],
  "approximation_prohibited": true,
  "evidence_requirements": [
    "crates/mncs-cli/tests/abi_boundary.rs: imported_nominal_types_agree_per_backend",
    "crates/mncs-compiler/tests/module_imports.rs: imported_nominal_types_resolve_in_signatures_projection_and_match, projection_from_a_non_record_value_is_rejected",
    "examples/execution/import-nominal-corpus.json via scripts/gen_import_nominal_corpus.py (10 cases PASS on all five backends)",
    "examples/source/test/nominal/machine.mncs + consumer.mncs (Phase/Evt/Transport)"
  ],
  "status": "PASS",
  "unresolved_fields": [
    "dotted QUALIFIED type paths require Profile 0.9+; unqualified unique imports work from 0.6",
    "dotted construction (Os.Linux) is canonical; double-colon value paths are not term syntax (INVALID, not a gap)"
  ],
  "identity": "mncs:0.2:capability-gap:a40e1ea5a76a90b94ad6d7be77ec6c3de30015bf039a28019c551ee77002d8d5"
}
